[
  {
    "name": "一个好色声音",
    "path": "一个好色声音.mp3",
    "date": "2022-12-26",
    "translate": {
      "zh-CN": "一个好色声音",
      "en-US": "一个好色声音"
    },
    "category": "糟糕",
    "mark": {
      "title": "群友投稿1"
    }
  },
  {
    "name": "我是wife",
    "path": "我是wife.mp3",
    "date": "2022-12-26",
    "translate": {
      "zh-CN": "我是wife",
      "en-US": "我是wife"
    },
    "category": "日常",
    "mark": {
      "title": "群友投稿1"
    }
  },
  {
    "name": "谢谢你",
    "path": "谢谢你.mp3",
    "date": "2022-12-26",
    "translate": {
      "zh-CN": "谢谢你",
      "en-US": "谢谢你"
    },
    "category": "日常",
    "mark": {
      "title": "群友投稿1"
    }
  },
  {
    "name": "爱老虎油1",
    "path": "爱老虎油1.mp3",
    "date": "2022-12-26",
    "translate": {
      "zh-CN": "爱老虎油",
      "en-US": "爱老虎油"
    },
    "category": "日常",
    "mark": {
      "title": "群友投稿1"
    }
  },
  {
    "name": "爱老虎油2",
    "path": "爱老虎油2.mp3",
    "date": "2022-12-26",
    "translate": {
      "zh-CN": "爱老虎油",
      "en-US": "爱老虎油"
    },
    "category": "日常",
    "mark": {
      "title": "群友投稿1"
    }
  },
  {
    "name": "爸爸跟孩子不会结婚",
    "path": "爸爸跟孩子不会结婚.mp3",
    "date": "2022-12-26",
    "translate": {
      "zh-CN": "爸爸跟孩子不会结婚",
      "en-US": "爸爸跟孩子不会结婚"
    },
    "category": "名言",
    "mark": {
      "title": "群友投稿1"
    }
  },
  {
    "name": "mother 哔——",
    "path": "mother 哔——.mp3",
    "date": "2022-12-26",
    "translate": {
      "zh-CN": "mother 哔——",
      "en-US": "mother 哔——"
    },
    "category": "糟糕",
    "mark": {
      "title": "群友投稿1"
    }
  },
  {
    "name": "mother fa——",
    "path": "mother fa——.mp3",
    "date": "2022-12-26",
    "translate": {
      "zh-CN": "mother fa——",
      "en-US": "mother fa——"
    },
    "category": "糟糕",
    "mark": {
      "title": "群友投稿1"
    }
  },
  {
    "name": "son of 哔——",
    "path": "son of 哔——.mp3",
    "date": "2022-12-26",
    "translate": {
      "zh-CN": "son of 哔——",
      "en-US": "son of 哔——"
    },
    "category": "糟糕",
    "mark": {
      "title": "群友投稿1"
    }
  },
  {
    "name": "阿姨洗铁路1",
    "path": "阿姨洗铁路1.mp3",
    "date": "2022-12-26",
    "translate": {
      "zh-CN": "阿姨洗铁路",
      "en-US": "阿姨洗铁路"
    },
    "category": "可爱",
    "mark": {
      "title": "群友投稿1"
    }
  },
  {
    "name": "你是什么笨蛋呀",
    "path": "你是什么笨蛋呀.mp3",
    "date": "2022-12-26",
    "translate": {
      "zh-CN": "你是什么笨蛋呀",
      "en-US": "你是什么笨蛋呀"
    },
    "category": "名言",
    "mark": {
      "title": "群友投稿1"
    }
  },
  {
    "name": "呃呃呃别",
    "path": "呃呃呃别.mp3",
    "date": "2022-12-26",
    "translate": {
      "zh-CN": "呃呃呃别",
      "en-US": "呃呃呃别"
    },
    "category": "糟糕",
    "mark": {
      "title": "群友投稿1"
    }
  },
  {
    "name": "钉宫三连",
    "path": "钉宫三连.mp3",
    "date": "2022-12-26",
    "translate": {
      "zh-CN": "钉宫三连",
      "en-US": "钉宫三连"
    },
    "category": "幼猫",
    "mark": {
      "title": "群友投稿1"
    }
  },
  {
    "name": "I love you too",
    "path": "I love you too.mp3",
    "date": "2022-12-26",
    "translate": {
      "zh-CN": "I love you too",
      "en-US": "I love you too"
    },
    "category": "可爱",
    "mark": {
      "title": "群友投稿1"
    }
  },
  {
    "name": "I love you too,mua~",
    "path": "I love you too,mua~.mp3",
    "date": "2022-12-26",
    "translate": {
      "zh-CN": "I love you too,mua~",
      "en-US": "I love you too,mua~"
    },
    "category": "可爱",
    "mark": {
      "title": "群友投稿1"
    }
  },
  {
    "name": "mua3",
    "path": "mua3.mp3",
    "date": "2022-12-26",
    "translate": {
      "zh-CN": "Um~mua~",
      "en-US": "Um~mua~"
    },
    "category": "mua",
    "mark": {
      "title": "群友投稿1"
    }
  },
  {
    "name": "nya~",
    "path": "nya~.mp3",
    "date": "2022-12-26",
    "translate": {
      "zh-CN": "nya~",
      "en-US": "nya~"
    },
    "category": "可爱",
    "mark": {
      "title": "群友投稿1"
    }
  },
  {
    "name": "rua",
    "path": "rua.mp3",
    "date": "2022-12-26",
    "translate": {
      "zh-CN": "rua",
      "en-US": "rua"
    },
    "category": "可爱",
    "mark": {
      "title": "群友投稿1"
    }
  },
  {
    "name": "wow",
    "path": "wow.mp3",
    "date": "2022-12-26",
    "translate": {
      "zh-CN": "wow",
      "en-US": "wow"
    },
    "category": "可爱",
    "mark": {
      "title": "群友投稿1"
    }
  },
  {
    "name": "噗噗",
    "path": "噗噗.mp3",
    "date": "2022-12-26",
    "translate": {
      "zh-CN": "噗噗",
      "en-US": "噗噗"
    },
    "category": "糟糕",
    "mark": {
      "title": "群友投稿1"
    }
  },
  {
    "name": "喵~2",
    "path": "喵~2.mp3",
    "date": "2022-12-26",
    "translate": {
      "zh-CN": "喵~",
      "en-US": "喵~"
    },
    "category": "可爱",
    "mark": {
      "title": "群友投稿1"
    }
  },
  {
    "name": "抱抱亲亲mua",
    "path": "抱抱亲亲mua.mp3",
    "date": "2022-12-26",
    "translate": {
      "zh-CN": "抱抱亲亲mua",
      "en-US": "抱抱亲亲mua"
    },
    "category": "mua",
    "mark": {
      "title": "群友投稿1"
    }
  },
  {
    "name": "王牛奶骂我呀",
    "path": "王牛奶骂我呀.mp3",
    "date": "2022-12-26",
    "translate": {
      "zh-CN": "王牛奶骂我呀",
      "en-US": "王牛奶骂我呀"
    },
    "category": "名言",
    "mark": {
      "title": "群友投稿1"
    }
  },
  {
    "name": "钉宫三连2",
    "path": "钉宫三连2.mp3",
    "date": "2022-12-26",
    "translate": {
      "zh-CN": "钉宫三连",
      "en-US": "钉宫三连"
    },
    "category": "可爱",
    "mark": {
      "title": "群友投稿1"
    }
  },
  {
    "name": "我的爸爸告诉我",
    "path": "我的爸爸告诉我.mp3",
    "date": "2022-12-26",
    "translate": {
      "zh-CN": "我的爸爸告诉我",
      "en-US": "我的爸爸告诉我"
    },
    "category": "日常",
    "mark": {
      "title": "群友投稿1"
    }
  },
  {
    "name": "啊~2",
    "path": "啊~2.mp3",
    "date": "2022-12-26",
    "translate": {
      "zh-CN": "啊~",
      "en-US": "啊~"
    },
    "category": "糟糕",
    "mark": {
      "title": "群友投稿1"
    }
  },
  {
    "name": "没事",
    "path": "没事.mp3",
    "date": "2022-12-26",
    "translate": {
      "zh-CN": "没事",
      "en-US": "没事"
    },
    "category": "日常",
    "mark": {
      "title": "群友投稿1"
    }
  },
  {
    "name": "你谁啊",
    "path": "你谁啊.mp3",
    "date": "2022-12-26",
    "translate": {
      "zh-CN": "你谁啊",
      "en-US": "你谁啊"
    },
    "category": "日常",
    "mark": {
      "title": "群友投稿1"
    }
  },
  {
    "name": "我害怕对不起对不起对不起",
    "path": "我害怕对不起对不起对不起.mp3",
    "date": "2022-12-26",
    "translate": {
      "zh-CN": "我害怕对不起对不起对不起",
      "en-US": "我害怕对不起对不起对不起"
    },
    "category": "日常",
    "mark": {
      "title": "群友投稿1"
    }
  },
  {
    "name": "OK~1~2~3~",
    "path": "OK~1~2~3~.mp3",
    "date": "2022-12-26",
    "translate": {
      "zh-CN": "OK~1~2~3~",
      "en-US": "OK~1~2~3~"
    },
    "category": "日常",
    "mark": {
      "title": "群友投稿1"
    }
  },
  {
    "name": "我们可以去约会吗",
    "path": "我们可以去约会吗.mp3",
    "date": "2022-12-26",
    "translate": {
      "zh-CN": "我们可以去约会吗",
      "en-US": "我们可以去约会吗"
    },
    "category": "日常",
    "mark": {
      "title": "群友投稿1"
    }
  },
  {
    "name": "我想亲亲",
    "path": "我想亲亲.mp3",
    "date": "2022-12-26",
    "translate": {
      "zh-CN": "我想亲亲",
      "en-US": "我想亲亲"
    },
    "category": "日常",
    "mark": {
      "title": "群友投稿1"
    }
  },
  {
    "name": "大家好我是粉色猫猫",
    "path": "大家好我是粉色猫猫.mp3",
    "date": "2022-12-26",
    "translate": {
      "zh-CN": "大家好我是粉色猫猫",
      "en-US": "大家好我是粉色猫猫"
    },
    "category": "日常",
    "mark": {
      "title": "群友投稿1"
    }
  },
  {
    "name": "晚上好你们好啊",
    "path": "晚上好你们好啊.mp3",
    "date": "2022-12-26",
    "translate": {
      "zh-CN": "晚上好你们好啊",
      "en-US": "晚上好你们好啊"
    },
    "category": "日常",
    "mark": {
      "title": "群友投稿1"
    }
  },
  {
    "name": "啊~~~2",
    "path": "啊~~~2.mp3",
    "date": "2022-12-26",
    "translate": {
      "zh-CN": "啊~~~",
      "en-US": "啊~~~"
    },
    "category": "糟糕",
    "mark": {
      "title": "群友投稿1"
    }
  },
  {
    "name": "大概是在哭",
    "path": "大概是在哭.mp3",
    "date": "2022-12-26",
    "translate": {
      "zh-CN": "大概是在哭",
      "en-US": "大概是在哭"
    },
    "category": "糟糕",
    "mark": {
      "title": "群友投稿1"
    }
  },
  {
    "name": "没有东西之歌",
    "path": "没有东西之歌.mp3",
    "date": "2022-12-26",
    "translate": {
      "zh-CN": "没有东西之歌",
      "en-US": "没有东西之歌"
    },
    "category": "可爱",
    "mark": {
      "title": "群友投稿1"
    }
  },
  {
    "name": "没问题之歌",
    "path": "没问题之歌.mp3",
    "date": "2022-12-26",
    "translate": {
      "zh-CN": "没问题之歌",
      "en-US": "没问题之歌"
    },
    "category": "可爱",
    "mark": {
      "title": "群友投稿1"
    }
  },
  {
    "name": "没问题之歌2",
    "path": "没问题之歌2.mp3",
    "date": "2022-12-26",
    "translate": {
      "zh-CN": "没问题之歌",
      "en-US": "没问题之歌"
    },
    "category": "可爱",
    "mark": {
      "title": "群友投稿1"
    }
  }
]
