[
  {
    "name": "别说了别说了别说了2",
    "path": "别说了别说了别说了2.mp3",
    "date": "2022-03-17",
    "translate": {
      "zh-CN": "别说了别说了别说了",
      "en-US": "Stop talking"
    },
    "category": "日常",
    "mark": {
      "title": "【Hiiro Record】5.18 Tue. 老角色扮演了",
      "time": "11:21~11:24",
      "url": "https://www.bilibili.com/video/BV14V411j7nN"
    }
  },
  {
    "name": "阿里嘎多~",
    "path": "阿里嘎多~.mp3",
    "date": "2022-03-17",
    "translate": {
      "zh-CN": "阿里嘎多~",
      "en-US": "Thank you~"
    },
    "category": "日常",
    "mark": {
      "title": "【Hiiro Record】5.18 Tue. 老角色扮演了",
      "time": "19:19~19:24",
      "url": "https://www.bilibili.com/video/BV14V411j7nN"
    }
  },
  {
    "name": "I am your girlfriend",
    "path": "I am your girlfriend.mp3",
    "date": "2022-03-17",
    "translate": {
      "zh-CN": "I am your girlfriend",
      "en-US": "I am your girlfriend"
    },
    "category": "清楚",
    "mark": {
      "title": "【Hiiro Record】5.18 Tue. 老角色扮演了",
      "time": "37:53~37:54",
      "url": "https://www.bilibili.com/video/BV14V411j7nN"
    }
  },
  {
    "name": "健康的笑声",
    "path": "健康的笑声.mp3",
    "date": "2022-03-17",
    "translate": {
      "zh-CN": "健康的笑声",
      "en-US": "Healthy laughter"
    },
    "category": "混沌",
    "mark": {
      "title": "【Hiiro Record】5.18 Tue. 老角色扮演了",
      "time": "57:10~57:35",
      "url": "https://www.bilibili.com/video/BV14V411j7nN"
    }
  },
  {
    "name": "健康的笑声2",
    "path": "健康的笑声2.mp3",
    "date": "2022-03-17",
    "translate": {
      "zh-CN": "健康的笑声",
      "en-US": "Healthy laughter"
    },
    "category": "混沌",
    "mark": {
      "title": "【Hiiro Record】5.18 Tue. 老角色扮演了",
      "time": "57:41~57:49",
      "url": "https://www.bilibili.com/video/BV14V411j7nN"
    }
  },
  {
    "name": "三点几啦",
    "path": "三点几啦.mp3",
    "date": "2022-03-17",
    "translate": {
      "zh-CN": "三点几啦",
      "en-US": "三点几啦"
    },
    "category": "混沌",
    "mark": {
      "title": "【Hiiro Record】5.18 Tue. 老角色扮演了",
      "time": "1:03:46~1:03:55",
      "url": "https://www.bilibili.com/video/BV14V411j7nN"
    }
  },
  {
    "name": "化物语绕口令",
    "path": "化物语绕口令.mp3",
    "date": "2022-03-17",
    "translate": {
      "zh-CN": "化物语绕口令",
      "en-US": "化物语绕口令"
    },
    "category": "可爱",
    "mark": {
      "title": "【Hiiro Record】5.18 Tue. 老角色扮演了",
      "time": "1:15:52~1:15:58",
      "url": "https://www.bilibili.com/video/BV14V411j7nN"
    }
  },
  {
    "name": "我是甜菜吗",
    "path": "我是甜菜吗.mp3",
    "date": "2022-03-17",
    "translate": {
      "zh-CN": "我是甜菜吗",
      "en-US": "Am I a genius?"
    },
    "category": "日常",
    "mark": {
      "title": "【Hiiro Record】5.18 Tue. 老角色扮演了",
      "time": "1:16:03~1:16:04",
      "url": "https://www.bilibili.com/video/BV14V411j7nN"
    }
  },
  {
    "name": "化物语绕口令2",
    "path": "化物语绕口令2.mp3",
    "date": "2022-03-17",
    "translate": {
      "zh-CN": "化物语绕口令2",
      "en-US": "化物语绕口令2"
    },
    "category": "可爱",
    "mark": {
      "title": "【Hiiro Record】5.18 Tue. 老角色扮演了",
      "time": "1:16:36~1:16:42",
      "url": "https://www.bilibili.com/video/BV14V411j7nN"
    }
  },
  {
    "name": "化物语绕口令3",
    "path": "化物语绕口令3.mp3",
    "date": "2022-03-17",
    "translate": {
      "zh-CN": "化物语绕口令3",
      "en-US": "化物语绕口令3"
    },
    "category": "可爱",
    "mark": {
      "title": "【Hiiro Record】5.18 Tue. 老角色扮演了",
      "time": "1:16:49~1:16:55",
      "url": "https://www.bilibili.com/video/BV14V411j7nN"
    }
  },
  {
    "name": "reoreoreo",
    "path": "reoreoreo.mp3",
    "date": "2022-03-17",
    "translate": {
      "zh-CN": "reoreoreo",
      "en-US": "reoreoreo"
    },
    "category": "混沌",
    "mark": {
      "title": "【Hiiro Record】5.18 Tue. 老角色扮演了",
      "time": "1:19:16~1:19:18",
      "url": "https://www.bilibili.com/video/BV14V411j7nN"
    }
  },
  {
    "name": "开水3",
    "path": "开水3.mp3",
    "date": "2022-03-17",
    "translate": {
      "zh-CN": "开水",
      "en-US": "Boiling Water"
    },
    "category": "烧开水",
    "mark": {
      "title": "【Hiiro Record】5.18 Tue. 老角色扮演了",
      "time": "1:19:19~1:19:20",
      "url": "https://www.bilibili.com/video/BV14V411j7nN"
    }
  },
  {
    "name": "不学不学",
    "path": "不学不学.mp3",
    "date": "2022-03-17",
    "translate": {
      "zh-CN": "不学不学",
      "en-US": "No Learning No Learning"
    },
    "category": "日常",
    "mark": {
      "title": "【Hiiro Record】5.18 Tue. 老角色扮演了",
      "time": "1:20:58~1:21:00",
      "url": "https://www.bilibili.com/video/BV14V411j7nN"
    }
  },
  {
    "name": "欢迎回家❤",
    "path": "欢迎回家❤.mp3",
    "date": "2022-03-17",
    "translate": {
      "zh-CN": "欢迎回家❤",
      "en-US": "Welcome Home❤"
    },
    "category": "清楚",
    "mark": {
      "title": "【Hiiro Record】5.18 Tue. 老角色扮演了",
      "time": "1:24:04~1:24:13",
      "url": "https://www.bilibili.com/video/BV14V411j7nN"
    }
  },
  {
    "name": "大姐姐老婆role play",
    "path": "大姐姐老婆role play.mp3",
    "date": "2022-03-17",
    "translate": {
      "zh-CN": "大姐姐老婆role play",
      "en-US": "wife role play"
    },
    "category": "清楚",
    "mark": {
      "title": "【Hiiro Record】5.18 Tue. 老角色扮演了",
      "time": "1:26:32~1:26:40",
      "url": "https://www.bilibili.com/video/BV14V411j7nN"
    }
  },
  {
    "name": "拜拜~",
    "path": "拜拜~.mp3",
    "date": "2022-03-17",
    "translate": {
      "zh-CN": "拜拜~",
      "en-US": "Bye-bye~"
    },
    "category": "日常",
    "mark": {
      "title": "【Hiiro Record】5.18 Tue. 老角色扮演了",
      "time": "1:26:47~1:26:48",
      "url": "https://www.bilibili.com/video/BV14V411j7nN"
    }
  },
  {
    "name": "打咩desu",
    "path": "打咩desu.mp3",
    "date": "2022-03-17",
    "translate": {
      "zh-CN": "打咩desu",
      "en-US": "da mie desu"
    },
    "category": "可爱",
    "mark": {
      "title": "【Hiiro Record】5.18 Tue. 老角色扮演了",
      "time": "1:27:09~1:27:13",
      "url": "https://www.bilibili.com/video/BV14V411j7nN"
    }
  },
  {
    "name": "呜呜呜~",
    "path": "呜呜呜~.mp3",
    "date": "2022-03-17",
    "translate": {
      "zh-CN": "呜呜呜~",
      "en-US": "wuwuwu~"
    },
    "category": "可爱",
    "mark": {
      "title": "【Hiiro Record】5.18 Tue. 老角色扮演了",
      "time": "1:27:15~1:27:17",
      "url": "https://www.bilibili.com/video/BV14V411j7nN"
    }
  },
  {
    "name": "萝莉老婆role play",
    "path": "萝莉老婆role play.mp3",
    "date": "2022-03-17",
    "translate": {
      "zh-CN": "萝莉老婆role play",
      "en-US": "loli wife role play"
    },
    "category": "清楚",
    "mark": {
      "title": "【Hiiro Record】5.18 Tue. 老角色扮演了",
      "time": "1:29:34~1:29:42",
      "url": "https://www.bilibili.com/video/BV14V411j7nN"
    }
  },
  {
    "name": "FBI!",
    "path": "FBI!.mp3",
    "date": "2022-03-17",
    "translate": {
      "zh-CN": "FBI!",
      "en-US": "FBI!"
    },
    "category": "日常",
    "mark": {
      "title": "【Hiiro Record】5.18 Tue. 老角色扮演了",
      "time": "1:30:16~1:30:18",
      "url": "https://www.bilibili.com/video/BV14V411j7nN"
    }
  },
  {
    "name": "完了完了",
    "path": "完了完了.mp3",
    "date": "2022-03-17",
    "translate": {
      "zh-CN": "完了完了",
      "en-US": "It's over. It's over."
    },
    "category": "日常",
    "mark": {
      "title": "【Hiiro Record】5.18 Tue. 老角色扮演了",
      "time": "1:30:36~1:30:37",
      "url": "https://www.bilibili.com/video/BV14V411j7nN"
    }
  },
  {
    "name": "惠惠",
    "path": "惠惠.mp3",
    "date": "2022-03-17",
    "translate": {
      "zh-CN": "惠惠",
      "en-US": "Megumin"
    },
    "category": "可爱",
    "mark": {
      "title": "【Hiiro Record】5.18 Tue. 老角色扮演了",
      "time": "1:36:39~1:36:47",
      "url": "https://www.bilibili.com/video/BV14V411j7nN"
    }
  },
  {
    "name": "Explosion",
    "path": "Explosion.mp3",
    "date": "2022-03-17",
    "translate": {
      "zh-CN": "Explosion",
      "en-US": "Explosion"
    },
    "category": "可爱",
    "mark": {
      "title": "【Hiiro Record】5.18 Tue. 老角色扮演了",
      "time": "1:36:54~1:36:56",
      "url": "https://www.bilibili.com/video/BV14V411j7nN"
    }
  },
  {
    "name": "bakuretsu lalala",
    "path": "bakuretsu lalala.mp3",
    "date": "2022-03-17",
    "translate": {
      "zh-CN": "bakuretsu lalala",
      "en-US": "bakuretsu lalala"
    },
    "category": "可爱",
    "mark": {
      "title": "【Hiiro Record】5.18 Tue. 老角色扮演了",
      "time": "1:36:58~1:37:03",
      "url": "https://www.bilibili.com/video/BV14V411j7nN"
    }
  },
  {
    "name": "你们真的有问题",
    "path": "你们真的有问题.mp3",
    "date": "2022-03-17",
    "translate": {
      "zh-CN": "你们真的有问题",
      "en-US": "You really have a problem."
    },
    "category": "日常",
    "mark": {
      "title": "【Hiiro Record】5.18 Tue. 老角色扮演了",
      "time": "1:40:37~1:40:38",
      "url": "https://www.bilibili.com/video/BV14V411j7nN"
    }
  },
  {
    "name": "Old McDonald Had A Farm",
    "path": "Old McDonald Had A Farm.mp3",
    "date": "2022-03-17",
    "translate": {
      "zh-CN": "Old McDonald Had A Farm",
      "en-US": "Old McDonald Had A Farm"
    },
    "category": "唱歌",
    "mark": {
      "title": "【Hiiro Record】5.18 Tue. 老角色扮演了",
      "time": "1:42:57~1:43:09",
      "url": "https://www.bilibili.com/video/BV14V411j7nN"
    }
  },
  {
    "name": "ABCDEFG",
    "path": "ABCDEFG.mp3",
    "date": "2022-03-17",
    "translate": {
      "zh-CN": "ABCDEFG",
      "en-US": "ABCDEFG"
    },
    "category": "唱歌",
    "mark": {
      "title": "【Hiiro Record】5.18 Tue. 老角色扮演了",
      "time": "1:43:18~1:43:23",
      "url": "https://www.bilibili.com/video/BV14V411j7nN"
    }
  }
]