[
  {
    "name": "切~垃圾",
    "path": "切~垃圾.mp3",
    "date": "2023-4-18",
    "translate": {
      "zh-CN": "切~垃圾",
      "en-US": "切~垃圾"
    },
    "category": "日常",
    "mark": {
      "title": "群友投稿2"
    }
  },
  {
    "name": "有个hentai！9me！",
    "path": "有个hentai！9me！.mp3",
    "date": "2023-4-18",
    "translate": {
      "zh-CN": "有个hentai！9me！",
      "en-US": "有个hentai！9me！"
    },
    "category": "日常",
    "mark": {
      "title": "群友投稿2"
    }
  },
  {
    "name": "hiihiihii",
    "path": "hiihiihii.mp3",
    "date": "2023-4-18",
    "translate": {
      "zh-CN": "hiihiihii",
      "en-US": "hiihiihii"
    },
    "category": "日常",
    "mark": {
      "title": "群友投稿2"
    }
  },
  {
    "name": "my欧派真的有点大",
    "path": "my欧派真的有点大.mp3",
    "date": "2023-4-18",
    "translate": {
      "zh-CN": "my欧派真的有点大",
      "en-US": "my欧派真的有点大"
    },
    "category": "糟糕",
    "mark": {
      "title": "群友投稿2"
    }
  },
  {
    "name": "这个真的有点大",
    "path": "这个真的有点大.mp3",
    "date": "2023-4-18",
    "translate": {
      "zh-CN": "这个真的有点大",
      "en-US": "这个真的有点大"
    },
    "category": "混沌",
    "mark": {
      "title": "群友投稿2"
    }
  },
  {
    "name": "不要~~",
    "path": "不要~~.mp3",
    "date": "2023-4-18",
    "translate": {
      "zh-CN": "不要~~",
      "en-US": "不要~~"
    },
    "category": "糟糕",
    "mark": {
      "title": "群友投稿2"
    }
  },
  {
    "name": "你这个！",
    "path": "你这个！.mp3",
    "date": "2023-4-18",
    "translate": {
      "zh-CN": "你这个！",
      "en-US": "你这个！"
    },
    "category": "日常",
    "mark": {
      "title": "群友投稿2"
    }
  },
  {
    "name": "去love hotel",
    "path": "去love hotel.mp3",
    "date": "2023-4-18",
    "translate": {
      "zh-CN": "去love hotel",
      "en-US": "去love hotel"
    },
    "category": "混沌",
    "mark": {
      "title": "群友投稿2"
    }
  },
  {
    "name": "哎呀宝贝儿",
    "path": "哎呀宝贝儿.mp3",
    "date": "2023-4-18",
    "translate": {
      "zh-CN": "哎呀宝贝儿",
      "en-US": "哎呀宝贝儿"
    },
    "category": "混沌",
    "mark": {
      "title": "群友投稿2"
    }
  },
  {
    "name": "哈斯哈斯",
    "path": "哈斯哈斯.mp3",
    "date": "2023-4-18",
    "translate": {
      "zh-CN": "哈斯哈斯",
      "en-US": "哈斯哈斯"
    },
    "category": "糟糕",
    "mark": {
      "title": "群友投稿2"
    }
  },
  {
    "name": "呼~",
    "path": "呼~.mp3",
    "date": "2023-4-18",
    "translate": {
      "zh-CN": "呼~",
      "en-US": "呼~"
    },
    "category": "可爱",
    "mark": {
      "title": "群友投稿2"
    }
  },
  {
    "name": "好热啊",
    "path": "好热啊.mp3",
    "date": "2023-4-18",
    "translate": {
      "zh-CN": "好热啊",
      "en-US": "好热啊"
    },
    "category": "日常",
    "mark": {
      "title": "群友投稿2"
    }
  },
  {
    "name": "好的主人",
    "path": "好的主人.mp3",
    "date": "2023-4-18",
    "translate": {
      "zh-CN": "好的主人",
      "en-US": "好的主人"
    },
    "category": "可爱",
    "mark": {
      "title": "群友投稿2"
    }
  },
  {
    "name": "安静安静",
    "path": "安静安静.mp3",
    "date": "2023-4-18",
    "translate": {
      "zh-CN": "安静安静",
      "en-US": "安静安静"
    },
    "category": "日常",
    "mark": {
      "title": "群友投稿2"
    }
  },
  {
    "name": "别说话了你个八嘎",
    "path": "别说话了你个八嘎.mp3",
    "date": "2023-4-18",
    "translate": {
      "zh-CN": "别说话了你个八嘎",
      "en-US": "别说话了你个八嘎"
    },
    "category": "日常",
    "mark": {
      "title": "群友投稿2"
    }
  },
  {
    "name": "很好很好很好",
    "path": "很好很好很好.mp3",
    "date": "2023-4-18",
    "translate": {
      "zh-CN": "很好很好很好",
      "en-US": "很好很好很好"
    },
    "category": "日常",
    "mark": {
      "title": "群友投稿2"
    }
  },
  {
    "name": "我爱王牛奶",
    "path": "我爱王牛奶.mp3",
    "date": "2023-4-18",
    "translate": {
      "zh-CN": "我爱王牛奶",
      "en-US": "我爱王牛奶"
    },
    "category": "名言",
    "mark": {
      "title": "群友投稿2"
    }
  },
  {
    "name": "为~什~么~",
    "path": "为~什~么~.mp3",
    "date": "2023-4-18",
    "translate": {
      "zh-CN": "为~什~么~",
      "en-US": "为~什~么~"
    },
    "category": "日常",
    "mark": {
      "title": "群友投稿2"
    }
  },
  {
    "name": "我的老公去哪里了",
    "path": "我的老公去哪里了.mp3",
    "date": "2023-4-18",
    "translate": {
      "zh-CN": "我的老公去哪里了",
      "en-US": "我的老公去哪里了"
    },
    "category": "名言",
    "mark": {
      "title": "群友投稿2"
    }
  },
  {
    "name": "哇我真牛逼啊",
    "path": "哇我真牛逼啊.mp3",
    "date": "2023-4-18",
    "translate": {
      "zh-CN": "哇我真牛逼啊",
      "en-US": "哇我真牛逼啊"
    },
    "category": "日常",
    "mark": {
      "title": "群友投稿2"
    }
  },
  {
    "name": "滋~~~~崩",
    "path": "滋~~~~崩.mp3",
    "date": "2023-4-18",
    "translate": {
      "zh-CN": "滋~~~~崩",
      "en-US": "滋~~~~崩"
    },
    "category": "日常",
    "mark": {
      "title": "群友投稿2"
    }
  },
  {
    "name": "爹！",
    "path": "爹！.mp3",
    "date": "2023-4-18",
    "translate": {
      "zh-CN": "爹！",
      "en-US": "爹！"
    },
    "category": "混沌",
    "mark": {
      "title": "群友投稿2"
    }
  },
  {
    "name": "苏卡不列",
    "path": "苏卡不列.mp3",
    "date": "2023-4-18",
    "translate": {
      "zh-CN": "苏卡不列",
      "en-US": "苏卡不列"
    },
    "category": "混沌",
    "mark": {
      "title": "群友投稿2"
    }
  }
]
