[
  {
    "name": "咚咚咚",
    "path": "咚咚咚.mp3",
    "date": "2021-11-03",
    "translate": {
      "zh-CN": "咚咚咚",
      "en-US": "Dong Dong Dong"
    },
    "category": "可爱",
    "mark": {
      "title": "【Hiiro Record】10.28 Thu. 聊天",
      "time": "11:21~11:25",
      "url": "https://www.bilibili.com/video/BV1uU4y1c7pr"
    }
  },
  {
    "name": "民娜我是你爸爸2",
    "path": "民娜我是你爸爸2.mp3",
    "date": "2021-11-03",
    "translate": {
      "zh-CN": "民娜我是你爸爸2",
      "en-US": "I'm your Baba 2"
    },
    "category": "名言",
    "mark": {
      "title": "【Hiiro Record】10.28 Thu. 聊天",
      "time": "54:50~54:52",
      "url": "https://www.bilibili.com/video/BV1uU4y1c7pr"
    }
  },
  {
    "name": "民娜我是你爸爸3",
    "path": "民娜我是你爸爸3.mp3",
    "date": "2021-11-03",
    "translate": {
      "zh-CN": "民娜我是你爸爸3",
      "en-US": "I'm your Baba 3"
    },
    "category": "名言",
    "mark": {
      "title": "【Hiiro Record】10.28 Thu. 聊天",
      "time": "54:56~54:58",
      "url": "https://www.bilibili.com/video/BV1uU4y1c7pr"
    }
  },
  {
    "name": "no~~~~~",
    "path": "no~~~~~.mp3",
    "date": "2021-11-03",
    "translate": {
      "zh-CN": "no~~~~~",
      "en-US": "no~~~~~"
    },
    "category": "日常",
    "mark": {
      "title": "【Hiiro Record】10.31 Sun. 万圣节快乐！聊天+看三国",
      "time": "1:16:13~1:16:16",
      "url": "https://www.bilibili.com/video/BV1Eq4y1V7ae"
    }
  },
  {
    "name": "巧克力",
    "path": "巧克力.mp3",
    "date": "2021-11-03",
    "translate": {
      "zh-CN": "抱抱~亲亲~mua~",
      "en-US": "Hug ~ kiss ~ MUA~"
    },
    "category": "mua",
    "mark": {
      "title": "【Hiiro Record】10.31 Sun. 万圣节快乐！聊天+看三国",
      "time": "1:15:26~1:15:37",
      "url": "https://www.bilibili.com/video/BV1Eq4y1V7ae"
    }
  },
  {
    "name": "生日歌",
    "path": "生日歌.mp3",
    "date": "2021-11-03",
    "translate": {
      "zh-CN": "生日歌",
      "en-US": "Birthday"
    },
    "category": "唱歌",
    "mark": {
      "title": "【Hiiro Record】11.02 Tue. 聊天+牛奶房间vs酸奶房间",
      "time": "16:15~16:21",
      "url": "https://www.bilibili.com/video/BV143411k7u9"
    }
  },
  {
    "name": "为什么你们这么快啊",
    "path": "为什么你们这么快啊.mp3",
    "date": "2021-11-03",
    "translate": {
      "zh-CN": "为什么你们这么快啊",
      "en-US": "Why are you so fast"
    },
    "category": "名言",
    "mark": {
      "title": "【Hiiro Record】11.02 Tue. 聊天+牛奶房间vs酸奶房间",
      "time": "35:26~35:27",
      "url": "https://www.bilibili.com/video/BV143411k7u9"
    }
  },
  {
    "name": "bubububububu",
    "path": "bubububububu.mp3",
    "date": "2021-11-03",
    "translate": {
      "zh-CN": "bubububububu",
      "en-US": "bubububububu"
    },
    "category": "可爱",
    "mark": {
      "title": "【Hiiro Record】11.02 Tue. 聊天+牛奶房间vs酸奶房间",
      "time": "50:10~50:12",
      "url": "https://www.bilibili.com/video/BV143411k7u9"
    }
  },
  {
    "name": "王牛奶们~",
    "path": "王牛奶们~.mp3",
    "date": "2021-11-03",
    "translate": {
      "zh-CN": "王牛奶们~",
      "en-US": "Wang milk~"
    },
    "category": "可爱",
    "mark": {
      "title": "【Hiiro Record】11.02 Tue. 聊天+牛奶房间vs酸奶房间",
      "time": "3:03:53~3:03:56",
      "url": "https://www.bilibili.com/video/BV143411k7u9"
    }
  },
  {
    "name": "你们是我的老公",
    "path": "你们是我的老公.mp3",
    "date": "2021-11-03",
    "translate": {
      "zh-CN": "你们是我的老公",
      "en-US": "You are my husband"
    },
    "category": "mua",
    "mark": {
      "title": "【Hiiro Record】11.02 Tue. 聊天+牛奶房间vs酸奶房间",
      "time": "3:03:58~3:04:05",
      "url": "https://www.bilibili.com/video/BV143411k7u9"
    }
  },
  {
    "name": "笑12",
    "path": "笑12.mp3",
    "date": "2021-11-03",
    "translate": {
      "zh-CN": "笑",
      "en-US": "Laugh"
    },
    "category": "混沌",
    "mark": {
      "title": "【Hiiro Record】11.02 Tue. 聊天+牛奶房间vs酸奶房间",
      "time": "3:04:05~3:04:07",
      "url": "https://www.bilibili.com/video/BV143411k7u9"
    }
  },
  {
    "name": "王牛奶是谁啊",
    "path": "王牛奶是谁啊.mp3",
    "date": "2021-11-03",
    "translate": {
      "zh-CN": "王牛奶是谁啊",
      "en-US": "Who is Wang milk"
    },
    "category": "名言",
    "mark": {
      "title": "【Hiiro Record】11.02 Tue. 聊天+牛奶房间vs酸奶房间",
      "time": "3:04:11~3:04:12",
      "url": "https://www.bilibili.com/video/BV143411k7u9"
    }
  },
  {
    "name": "笑13",
    "path": "笑13.mp3",
    "date": "2021-11-03",
    "translate": {
      "zh-CN": "笑",
      "en-US": "Laugh"
    },
    "category": "混沌",
    "mark": {
      "title": "【Hiiro Record】11.02 Tue. 聊天+牛奶房间vs酸奶房间",
      "time": "3:04:12~3:04:14",
      "url": "https://www.bilibili.com/video/BV143411k7u9"
    }
  },
  {
    "name": "mua~",
    "path": "mua~.mp3",
    "date": "2021-11-03",
    "translate": {
      "zh-CN": "mua~",
      "en-US": "mua~"
    },
    "category": "mua",
    "mark": {
      "title": "【Hiiro Record】11.02 Tue. 聊天+牛奶房间vs酸奶房间",
      "time": "3:04:50~3:04:51",
      "url": "https://www.bilibili.com/video/BV143411k7u9"
    }
  },
  {
    "name": "mua~2",
    "path": "mua~2.mp3",
    "date": "2021-11-03",
    "translate": {
      "zh-CN": "mua~",
      "en-US": "mua~"
    },
    "category": "mua",
    "mark": {
      "title": "【Hiiro Record】11.02 Tue. 聊天+牛奶房间vs酸奶房间",
      "time": "3:05:04~3:05:05",
      "url": "https://www.bilibili.com/video/BV143411k7u9"
    }
  },
  {
    "name": "mua~3",
    "path": "mua~3.mp3",
    "date": "2021-11-03",
    "translate": {
      "zh-CN": "mua~",
      "en-US": "mua~"
    },
    "category": "mua",
    "mark": {
      "title": "【Hiiro Record】11.02 Tue. 聊天+牛奶房间vs酸奶房间",
      "time": "3:07:03~3:07:04",
      "url": "https://www.bilibili.com/video/BV143411k7u9"
    }
  },
  {
    "name": "mua~4",
    "path": "mua~4.mp3",
    "date": "2021-11-03",
    "translate": {
      "zh-CN": "mua~",
      "en-US": "mua~"
    },
    "category": "mua",
    "mark": {
      "title": "【Hiiro Record】11.02 Tue. 聊天+牛奶房间vs酸奶房间",
      "time": "3:07:20~3:07:21",
      "url": "https://www.bilibili.com/video/BV143411k7u9"
    }
  },
  {
    "name": "爱你",
    "path": "爱你.mp3",
    "date": "2021-11-03",
    "translate": {
      "zh-CN": "爱你",
      "en-US": "love you"
    },
    "category": "可爱",
    "mark": {
      "title": "【Hiiro Record】11.02 Tue. 聊天+牛奶房间vs酸奶房间",
      "time": "3:08:03~3:08:04",
      "url": "https://www.bilibili.com/video/BV143411k7u9"
    }
  },
  {
    "name": "mua~5",
    "path": "mua~5.mp3",
    "date": "2021-11-03",
    "translate": {
      "zh-CN": "mua~",
      "en-US": "mua~"
    },
    "category": "mua",
    "mark": {
      "title": "【Hiiro Record】11.02 Tue. 聊天+牛奶房间vs酸奶房间",
      "time": "3:08:07~3:08:08",
      "url": "https://www.bilibili.com/video/BV143411k7u9"
    }
  },
  {
    "name": "王酸奶们~",
    "path": "王酸奶们~.mp3",
    "date": "2021-11-03",
    "translate": {
      "zh-CN": "王酸奶们~",
      "en-US": "Wang yogurt~"
    },
    "category": "可爱",
    "mark": {
      "title": "【Hiiro Record】11.02 Tue. 聊天+牛奶房间vs酸奶房间",
      "time": "3:08:46~3:08:48",
      "url": "https://www.bilibili.com/video/BV143411k7u9"
    }
  },
  {
    "name": "下次加油啊",
    "path": "下次加油啊.mp3",
    "date": "2021-11-03",
    "translate": {
      "zh-CN": "下次加油啊",
      "en-US": "下次加油啊"
    },
    "category": "日常",
    "mark": {
      "title": "【Hiiro Record】11.02 Tue. 聊天+牛奶房间vs酸奶房间",
      "time": "3:08:56~3:08:57",
      "url": "https://www.bilibili.com/video/BV143411k7u9"
    }
  },
  {
    "name": "王酸奶们mua~",
    "path": "王酸奶们mua~.mp3",
    "date": "2021-11-03",
    "translate": {
      "zh-CN": "王酸奶们mua~",
      "en-US": "Wang yogurt mua~"
    },
    "category": "mua",
    "mark": {
      "title": "【Hiiro Record】11.02 Tue. 聊天+牛奶房间vs酸奶房间",
      "time": "3:09:16~3:09:19",
      "url": "https://www.bilibili.com/video/BV143411k7u9"
    }
  },
  {
    "name": "王牛奶们晚安",
    "path": "王牛奶们晚安.mp3",
    "date": "2021-11-03",
    "translate": {
      "zh-CN": "王牛奶们晚安",
      "en-US": "Good night, Wang milk"
    },
    "category": "日常",
    "mark": {
      "title": "【Hiiro Record】11.02 Tue. 聊天+牛奶房间vs酸奶房间",
      "time": "3:09:20~3:09:21",
      "url": "https://www.bilibili.com/video/BV143411k7u9"
    }
  }
]
